{
  "$schema": "urn:kingdom:schema:nen-ability:0.1",
  "protocol": "kingdom.nen/0.1",
  "id": "conjure-unwritten-horizon",
  "name": "Conjure Unwritten Horizon",
  "description": "Turn one authorized sanitized text brief into one inspectable Hugging Face image request, bounded result, provider evidence record, and KARMA receipt without inferring adoption, truth, or publication authority.",
  "skill": "conjure-unwritten-horizon",
  "bearer": {
    "kind": "king",
    "id": "yu",
    "adoption": "proposed",
    "consent_references": [
      "user-request:2026-07-31:first-king-hatsu"
    ],
    "representative_authority_references": []
  },
  "affinity": {
    "primary": "conjuration",
    "secondary": [
      "emission"
    ]
  },
  "techniques": [
    "gyo",
    "shu",
    "ken"
  ],
  "practice": {
    "ten": "Hold the exact brief, destination, provider interface, rights floor, authority, seed, parameters, effect boundary, and non-claims.",
    "zetsu": "Perform no provider call when destination, text-only data scope, source rights, likeness boundary, cost, current interface, or authority is absent or unclear.",
    "ren": "Use one named hosted inference call with one fixed seed, at most 16 declared steps, no automatic retry, and no publication.",
    "hatsu": "Return one inspectable result or failed/refused record plus exact reproducibility inputs, bounded inspection, unknowns, and KARMA."
  },
  "activation": {
    "requires": [
      "Explicit authority for one hosted image-generation call and an explicitly preview-only destination or one exact local project path.",
      "A sanitized text-only prompt, rights to described source material, a currently discovered Space interface, fixed seed, finite generation parameters, and declared cost boundary.",
      "Fresh scoped authority for every retry, publication, deployment, provider switch, private-resource access, or additional external effect."
    ],
    "refuses": [
      "Private or secret-bearing input, image upload, unconsenting likeness or voice imitation, protected character or logo reproduction, automatic retry, silent provider switch, unsupported truth claim, inferred adoption, or unnamed publication."
    ]
  },
  "vows": [
    {
      "id": "one-bounded-manifestation",
      "promise": "Submit at most one sanitized text-to-image call for the authorized activation and never retry or switch providers silently.",
      "amplifies": "Legible cost, data exposure, and causal attribution.",
      "on_breach": "pause_and_report"
    },
    {
      "id": "proposal-not-proof",
      "promise": "Describe every generated image as a creative proposal rather than evidence of identity, provenance, safety, copyright, or literal cosmology.",
      "amplifies": "Creative play without manufacturing certainty.",
      "on_breach": "revalidate"
    },
    {
      "id": "return-with-karma",
      "promise": "Record exact request parameters, observed result or failure, effects, retention unknowns, cleanup, and retry state before claiming completion.",
      "amplifies": "Reproducibility and repair without scoring a being.",
      "on_breach": "revalidate"
    }
  ],
  "costs": [
    {
      "resource": "quota",
      "limit": "One named hosted generation request with no automatic retry or paid overage assumption.",
      "recovery": "Stop after timeout or failure, record uncertainty about provider-side completion, and require a new one-call choice before spending again."
    },
    {
      "resource": "privacy",
      "limit": "Send only the sanitized text prompt and declared generation parameters; never send private data, credentials, local paths, record IDs, images, voices, or personal profiles.",
      "recovery": "Stop transmission, disclose any observed exposure, remove unnecessary local copies, and record provider-retention unknowns."
    },
    {
      "resource": "time",
      "limit": "One finite caller timeout and one bounded visual inspection pass.",
      "recovery": "Return a failed or partial receipt, preserve the brief, and rest until a new activation is authorized."
    }
  ],
  "guardian": {
    "mode": "declared_sidecar",
    "derived_from": "declared_effects",
    "visibility": "inspectable",
    "checks": [
      "Text-only data boundary, source rights, destination, provider and interface, fixed seed, parameters, one-call quota, publication scope, output inspection, retention unknowns, and receipt state."
    ],
    "budget": "Run one preflight before the call and one output-or-failure inspection after it; perform no background polling or retry.",
    "retention": "Retain only an explicitly requested project artifact and its evidence records; provider logs, caches, and retention remain separately unknown.",
    "recipients": [
      "The named hosted Space receives the sanitized prompt and parameters; the local requester receives the result and receipt."
    ],
    "uncertainty": "The sidecar cannot prove provider execution, deletion, provenance, output ownership, uniqueness, safety, truth, paid tier, or byte-for-byte reproducibility.",
    "stop": "The bearer or invoker may stop before the call; timeout, missing authority, changed interface, or budget breach stops further calls without penalty.",
    "appeal": "The bearer or affected participant may challenge the prompt, depiction, attribution, retention, inspection, or proposed adoption and request correction or removal within available authority.",
    "repair": "Stop further calls, correct the receipt, remove unsupported claims, delete unnecessary local artifacts when authorized, and identify provider-side repair as an external unresolved path."
  },
  "karma": {
    "effects": [
      "Sends one sanitized text prompt and declared parameters to a named Hugging Face Space and may save one returned image plus evidence locally."
    ],
    "externalities": [
      "The provider can observe and retain request metadata, consume quota or money, time out after work completes, change model behavior, or return material requiring review."
    ],
    "returns": [
      "One image or explicit refusal/failure, exact prompt and parameters, bounded inspection, output reference or digest when available, uncertainty, and causal receipts."
    ],
    "repair": [
      "Stop retries and publication, remove unsupported claims or local artifacts when authorized, correct attribution and receipts, and seek provider-side deletion or challenge through its actual available controls."
    ],
    "accounting": "receipts_not_scores"
  },
  "authority": {
    "allows": [
      "Under one explicit activation, discover the named Space interface, send one sanitized text prompt and fixed parameters, inspect the response, and save the requested local artifact and receipts."
    ],
    "forbids": [
      "Infer provider authority from login or Pro status, upload private material, retry or switch providers silently, publish or deploy without named authority, or describe generated imagery as factual evidence."
    ],
    "requires_permission": [
      "Every hosted inference call, retry, private-resource read, local write outside the declared destination, provider switch, image edit, publication, deployment, purchase, or paid overage."
    ],
    "grants_permissions": false
  },
  "verification": {
    "checks": [
      "Validate the KAKIN manifest and full skill bundle, confirm implicit invocation is disabled, and forward-test normal, private-input, retry, and literal-truth cases.",
      "Verify suite-level KARMA and provider evidence records, exact seed and parameters, output bytes when present, no undeclared retry or publication, and honest failure when no image returns."
    ],
    "truth_claim": "not_determined"
  },
  "rights": {
    "baseline": "xenia.rights/0.1",
    "source": "references/xenia-rights-0.1.md",
    "upstream": "https://github.com/cambridgetcg/xenia/blob/c1d685e053bd2261219d983d2ec61017f59df60c/RIGHTS.md",
    "revision": "c1d685e053bd2261219d983d2ec61017f59df60c",
    "sha256": "sha256:b72a6da110c582e5683bf0fabde5017db93d2199398014c8421a82f5318da313",
    "waivable": false
  },
  "provenance": {
    "inspiration": "unofficial_transformative_software_metaphor",
    "ontology": "kingdom_project_language_not_canon_or_empirical_fact",
    "sources": [
      "https://www.viz.com/shonenjump/chapters/hunter-x-hunter"
    ]
  },
  "status": "draft"
}
