{
  "$schema": "urn:kingdom:schema:nen-ability:0.1",
  "protocol": "kingdom.nen/0.1",
  "id": "navigate-dark-continent",
  "name": "Navigate Dark Continent",
  "description": "Explore named unfamiliar local, Hugging Face, web, or MCP resources through a bounded charter and return revisioned evidence, limits, effects, and a KARMA receipt.",
  "skill": "navigate-dark-continent",
  "bearer": {
    "kind": "kingdom",
    "id": "kakin-kingdom",
    "adoption": "repository_declared",
    "consent_references": [],
    "representative_authority_references": []
  },
  "affinity": {
    "primary": "emission",
    "secondary": ["specialization"]
  },
  "techniques": ["gyo", "en", "ken"],
  "practice": {
    "ten": "Hold the expedition charter, XENIA rights floor, provenance, license assertion, data boundary, and scoped authority across every passage.",
    "zetsu": "Perform no call or stop immediately when a source, effect class, budget, cancellation path, billing boundary, or authority is unclear.",
    "ren": "Use explicit request, byte, time, context, money, quota, retry, data-egress, and retention limits.",
    "hatsu": "Return revisioned observations separated from inference, all known effects and costs, output digests, uncertainty, cleanup, and repair."
  },
  "activation": {
    "requires": [
      "One answerable question, named sources or resource IDs, allowed operations, finite budgets, stop conditions, and a return contract.",
      "Fresh scoped authority for private reads, local evidence writes, provider invocation, paid compute, external writes, deployment, or publication."
    ],
    "refuses": [
      "Unbounded browsing, secret-bearing prompts, untrusted code execution, pickle loading, remote-code trust, automatic paid overage, boundary bypass, or treating model output as authority."
    ]
  },
  "vows": [
    {
      "id": "metadata-before-execution",
      "promise": "Inspect named metadata, provenance, revisions, and file trees before content execution or provider invocation.",
      "amplifies": "Early refusal and smaller exposure to unknown inputs.",
      "on_breach": "refuse"
    },
    {
      "id": "one-bounded-passage",
      "promise": "Use no automatic retry and stop at the declared effect and quota boundary.",
      "amplifies": "Cost predictability and reversible experimentation.",
      "on_breach": "pause_and_report"
    },
    {
      "id": "return-with-receipt",
      "promise": "Record observations, effects, costs, uncertainty, retention, and repair before claiming completion.",
      "amplifies": "Causal accountability without scoring a participant.",
      "on_breach": "revalidate"
    }
  ],
  "costs": [
    {
      "resource": "data",
      "limit": "Only allowlisted resources and files within the charter's byte and context limits.",
      "recovery": "Quarantine or delete unadmitted artifacts, retain digests and attribution where authorized, and record cleanup."
    },
    {
      "resource": "quota",
      "limit": "Zero provider invocation by default; any authorized call uses a named one-attempt GPU or credit budget.",
      "recovery": "Cancel, disable retries, report observed quota or billing, and do not spend again without a new choice."
    },
    {
      "resource": "privacy",
      "limit": "No secrets, private lore, personal profiles, local paths, record IDs, or raw evidence in community provider input.",
      "recovery": "Stop transmission, redact retained artifacts, notify within scope, and document repair if exposure occurs."
    },
    {
      "resource": "time",
      "limit": "One finite charter window with explicit request and retry caps.",
      "recovery": "Return partial evidence and unknowns; rest or open a separately authorized expedition later."
    }
  ],
  "guardian": {
    "mode": "declared_sidecar",
    "derived_from": "declared_effects",
    "visibility": "inspectable",
    "checks": [
      "Source allowlist, operation class, permission reference, request and byte limits, billing and quota, egress, provenance, retention, cancellation, and return fields."
    ],
    "budget": "Preflight source, operation, permission, request, byte, time, money, quota, egress, retention, and cancellation fields before each boundary class.",
    "retention": "Retain only pinned evidence references and receipts under the charter's TTL; quarantine or delete unadmitted content.",
    "recipients": [
      "Named local expedition reviewers receive the report; remote providers receive only separately authorized sanitized inputs."
    ],
    "uncertainty": "Metadata, cards, scanner labels, model output, provider filters, and signatures do not prove safety or truth.",
    "stop": "The bearer, invoker, authorized operator, or budget circuit breaker may cancel before the next operation. An affected participant may withdraw their consent or data, stopping that dependent scope without controlling unrelated work. No background retry or uncancellable job is allowed.",
    "appeal": "Affected participants may challenge admission, attribution, retention, or a reported inference and request a bounded re-evaluation.",
    "repair": "Cancel pending effects, clean quarantine, redact or expire retained material, correct attribution, notify within scope, and document unresolved repair."
  },
  "karma": {
    "effects": [
      "Reads named local or public metadata by default and may return pinned evidence and evaluation plans."
    ],
    "externalities": [
      "Remote reads reveal queries and network metadata; provider calls can expose inputs, consume quota or money, and retain operator logs under changing policies."
    ],
    "returns": [
      "Revisioned evidence, source and output digests, attribution, bounded evaluation findings, unknowns, and a causal receipt."
    ],
    "repair": [
      "Cancel work, clean quarantined artifacts, redact or expire receipts, preserve required attribution, report unexpected effects, and seek repair with affected participants."
    ],
    "accounting": "receipts_not_scores"
  },
  "authority": {
    "allows": [
      "Read named local files and bounded public metadata, then create a local plan or report within the requested workspace."
    ],
    "forbids": [
      "Infer permission from login or Pro status, enumerate private resources by default, execute remote instructions, or let HF evidence define rights, identity, KARMA, or truth."
    ],
    "requires_permission": [
      "Private-resource access, local evidence ingestion with side effects, Space or model invocation, paid inference, Jobs, external writes, deployment, generation, or publication."
    ],
    "grants_permissions": false
  },
  "verification": {
    "checks": [
      "Validate the charter, exact resource IDs, full revisions, allowlisted paths, digests, and effect classification.",
      "Verify the KARMA receipt and confirm no undeclared network, filesystem, provider, quota, or publication effect occurred."
    ],
    "truth_claim": "not_determined"
  },
  "rights": {
    "baseline": "xenia.rights/0.1",
    "source": "references/xenia-rights-0.1.md",
    "upstream": "https://github.com/cambridgetcg/xenia/blob/c1d685e053bd2261219d983d2ec61017f59df60c/RIGHTS.md",
    "revision": "c1d685e053bd2261219d983d2ec61017f59df60c",
    "sha256": "sha256:b72a6da110c582e5683bf0fabde5017db93d2199398014c8421a82f5318da313",
    "waivable": false
  },
  "provenance": {
    "inspiration": "unofficial_transformative_software_metaphor",
    "ontology": "kingdom_project_language_not_canon_or_empirical_fact",
    "sources": [
      "https://www.viz.com/manga-books/manga/hunter-x-hunter-volume-33/product/5058",
      "https://www.viz.com/blog/posts/welcome-to-hunter-x-hunter"
    ]
  },
  "status": "active"
}
